_id,title,link,date,source,regulatory_body,release_no,content,full_content,categories,impact_areas,geographic_scope,summary,processed,last_updated
67eeb3845caf767e40cce692,SEC Charges Justinas Butkus with Orchestrating $4 Million Fraud,https://www.sec.gov/newsroom/press-releases/2025-46,,SEC,Securities and Exchange Commission,2025-46,"Butkus used fraudulent investment firms TBO Capital and Gray Capital to scam investors

The Securities and Exchange Commission today filed charges against Justinas Butkus, of Lithuania, and two companies he owned and controlled, HMC Trading LLC and HMC Management LLC, for fraudulently raising approximately $4.1 million from 64 investors by selling interests in mutual funds that did not exist.

As alleged in the SEC’s complaint, in late 2021, Butkus, under the alias Darius Karpavicius, operated f","Butkus used fraudulent investment firms TBO Capital and Gray Capital to scam investors

The Securities and Exchange Commission today filed charges against Justinas Butkus, of Lithuania, and two companies he owned and controlled, HMC Trading LLC and HMC Management LLC, for fraudulently raising approximately $4.1 million from 64 investors by selling interests in mutual funds that did not exist.

As alleged in the SEC’s complaint, in late 2021, Butkus, under the alias Darius Karpavicius, operated fictitious investment firms TBO Capital Group and Gray Capital Group and offered investors shares in sham mutual funds through the firms’ websites, a press release, and internet advertisements, all of which made numerous materially false and misleading statements. According to the complaint, these websites and other materials falsely stated, among other things, that the TBO Capital and Gray Capital mutual funds were managed by industry professionals with decades of experience and achieved years of high-yield investment returns. In reality, the complaint alleges, the managers did not exist, their biographies were fake, and TBO Capital Group and Gray Capital Group never made any investments. Rather, as alleged, the entire operation was a fraud run by Butkus to enrich himself. Butkus allegedly used some of the investors' money to operate his fraudulent scheme, but stole most for his personal benefit, such as dining at restaurants, cash withdrawals, and crypto asset purchases.

“Butkus’ conduct was egregious: He went to great lengths to defraud unsuspecting investors using sophisticated websites, internet advertisements, and an alias complete with a doctored passport,” said Samuel Waldon, Acting Director of the SEC’s Division of Enforcement. “This case underscores the SEC’s unwavering commitment to hold individuals accountable for engaging in fraud that harms retail investors.”

The SEC is refiling this action, which it voluntarily dismissed on January 11, 2024, against Butkus’s alias, “Darius Karpavicius,” through a dismissal without prejudice.

The complaint, filed in federal court in Manhattan, charges Butkus, HMC Trading LLC, and HMC Management LLC with violating the registration and antifraud provisions of the federal securities laws and names another Butkus-controlled entity, DK Auto LLC, as a relief defendant. The SEC seeks permanent injunctive relief, disgorgement with prejudgment interest, and civil penalties against each of the defendants. It also seeks disgorgement with interest from the relief defendant.

The SEC’s investigation was conducted by Benjamin Vaughn, Katherine H. Stella, and Andrea Fox with assistance from the Division of Enforcement’s Office of Investigative and Market Analytics. It was supervised by Peter Rosario, George Bagnall, and Stacy L. Bogert. The litigation will be led by Peter Lallas and supervised by James Connor. The SEC appreciates the assistance of Homeland Security Investigations’ New York Field Office and the U.S. Attorney’s Office for the Southern District of New York.","Financial Regulations, Investment","Investors, US Economy",USA,,False,2025-04-03T16:12:52.577756
67eeb3855caf767e40cce693,SEC Investor Advisory Committee to Examine the Disclosure of AI’s Impact on Company Operations; and Retail Investor Fraud in America at March 6 Meeting,https://www.sec.gov/newsroom/press-releases/2025-45,,SEC,Securities and Exchange Commission,2025-45,"The Securities and Exchange Commission’s Investor Advisory Committee will hold a public meeting at the SEC Headquarters in Washington, D.C., on March 6, at 10 a.m. ET. The meeting will also be webcast on the SEC website.

The committee will host two panels:

Disclosure of Artificial Intelligence’s Impact on Operations; and

Retail Investor Fraud in America

The Committee will also discuss a potential recommendation regarding preserving investors’ ability to bring claims under Section 11 of the S","The Securities and Exchange Commission’s Investor Advisory Committee will hold a public meeting at the SEC Headquarters in Washington, D.C., on March 6, at 10 a.m. ET. The meeting will also be webcast on the SEC website.

The committee will host two panels:

Disclosure of Artificial Intelligence’s Impact on Operations; and

Retail Investor Fraud in America

The Committee will also discuss a potential recommendation regarding preserving investors’ ability to bring claims under Section 11 of the Securities Act of 1933. The full meeting agenda is available on the committee’s webpage.

The Investor Advisory Committee, which focuses on investor-related interests, advises the Commission on regulatory priorities and various initiatives to help protect investors and promote the integrity of the U.S. securities markets. Established by statute, the committee is authorized by Congress to submit findings and recommendations to the Commission.

To learn more about the Investor Advisory Committee visit the committee’s webpage.","Financial Regulations, Investment","Investors, US Economy",USA,,False,2025-04-03T16:12:53.411217
67eeb3865caf767e40cce694,"SEC Charges Alan Burak, Founder of Never Alone Capital, with Fraud",https://www.sec.gov/newsroom/press-releases/2025-44,,SEC,Securities and Exchange Commission,2025-44,"The Securities and Exchange Commission today charged Alan Burak, founder of Never Alone Capital LLC, with orchestrating a fraudulent scheme that raised approximately $4 million, most of which Burak misappropriated for personal expenses.

The SEC’s complaint alleges that, between 2018 and 2023, Burak engaged in a fraudulent scheme to recruit investors in his so-called investment fund, Never Alone Capital LLC, by falsely representing himself as a wealthy hedge fund owner, telling investors that Ne","The Securities and Exchange Commission today charged Alan Burak, founder of Never Alone Capital LLC, with orchestrating a fraudulent scheme that raised approximately $4 million, most of which Burak misappropriated for personal expenses.

The SEC’s complaint alleges that, between 2018 and 2023, Burak engaged in a fraudulent scheme to recruit investors in his so-called investment fund, Never Alone Capital LLC, by falsely representing himself as a wealthy hedge fund owner, telling investors that Never Alone was an investment fund, and claiming that investor money would be invested in “Wall Street” pursuant to a complex investment strategy, in some cases with a guaranteed return. Burak allegedly raised approximately $4 million from at least 17 investors, several of whom he met through a company that provides financial education programs in Spanish to the Latino community. However, as alleged in the complaint, Burak did not invest the money as he represented that he would. In fact, as alleged, Burak misappropriated the bulk of investor deposits, including to pay credit card charges for, among other things, luxury skin care and payments to an adult-only subscription service. Burak also allegedly sent investors false account statements that generally showed consistently positive returns, when in fact investors were consistently losing money. Burak eventually stopped responding to investors and, in an audio recording from July 2022, he stated, among other things, that he was fake, he did not have a real business, and he was stealing money from people.

“As our complaint alleges, Burak convinced investors to trust him by lying about his investment expertise and strategies and then stole their money,” said Samuel Waldon, Acting Director of the SEC’s Division of Enforcement. “We remain committed to identifying and holding accountable those who prey on innocent investors, and encourage those who suspect they are victims of fraud to report it to the SEC.”

The SEC’s complaint, filed in the U.S. District Court for the Southern District of New York, charges Burak with violating the antifraud provisions of the federal securities laws. The complaint seeks permanent injunctions, disgorgement of ill-gotten gains together with prejudgment interest, and civil penalties, as well as conduct-based injunctions.

In a parallel action, the New York County District Attorney’s Office today filed criminal charges against Burak.

The SEC’s investigation was conducted by Bari R. Nadworny, Thomas Feretic, and Lindsay S. Moilanen under the supervision of Tejal D. Shah of the New York Regional Office. The litigation will be led by Sushila Rao Pentapati and Ms. Nadworny under the supervision of Preethi Krishnamurthy.

If you think you could be the victim of a fraud, please submit a tip or complaint to the SEC.","Financial Regulations, Investment","Investors, US Economy",USA,,False,2025-04-03T16:12:54.226673
67eeb3875caf767e40cce695,SEC Extends Compliance Dates and Provides Temporary Exemption for Rule Related to Clearing of U.S. Treasury Securities,https://www.sec.gov/newsroom/press-releases/2025-43,,SEC,Securities and Exchange Commission,2025-43,"The Securities and Exchange Commission today extended the compliance dates for Rule 17ad-22(e)(18)(iv)(A) and (B) under the Securities Exchange Act by one year to Dec. 31, 2026, for eligible cash market transactions, and June 30, 2027, for eligible repo market transactions. Under the rule, a covered clearing agency that provides central counterparty services for U.S. Treasury securities must establish, implement, maintain, and enforce written policies and procedures reasonably designed to requir","The Securities and Exchange Commission today extended the compliance dates for Rule 17ad-22(e)(18)(iv)(A) and (B) under the Securities Exchange Act by one year to Dec. 31, 2026, for eligible cash market transactions, and June 30, 2027, for eligible repo market transactions. Under the rule, a covered clearing agency that provides central counterparty services for U.S. Treasury securities must establish, implement, maintain, and enforce written policies and procedures reasonably designed to require that every direct participant of the covered clearing agency submit for clearance and settlement all eligible secondary market transactions in U.S. Treasury securities to which it is a counterparty. The rule also requires a covered clearing agency to identify and monitor its direct participants’ submissions of transactions for clearing, including how the covered clearing agency would address a failure to submit transactions.

The Commission also issued a temporary exemption regarding Exchange Act Rule 17ad-22(e)(6)(i). This rule requires that covered clearing agencies have written policies and procedures reasonably designed to calculate, collect, and hold margin amounts from a direct participant for its proprietary positions in U.S. Treasury securities separately and independently from margin calculated and collected from that direct participant in connection with U.S. Treasury securities transactions by an indirect participant that relies on the services provided by the direct participant to access the U.S. Treasury securities covered clearing agency’s payment, clearing, or settlement facilities. Under this temporary exemption, a U.S. Treasury securities covered clearing agency is not required to enforce its written policies and procedures regarding Rule 17ad-22(e)(6)(i) until Sept. 30, 2025, instead of the original March 31, 2025, compliance date.

“The U.S. Treasury market is a critical piece of the global financial system. New rules must be implemented properly, and any operational issues must be addressed,” said SEC Acting Chairman Mark T. Uyeda. “This one-year extension provides additional time to implement and validate operational changes. Direct participants will also have more time to implement important risk management changes to comply with U.S. Treasury covered clearing agency rules. The Commission stands ready to engage with market participants on issues associated with implementation.”

The extension will provide additional time for further engagement on compliance, operational, and interpretive questions, and facilitate an orderly implementation of the rules. The temporary exemption allows covered clearing agencies not to enforce policies and procedures established pursuant to Rule 17ad-22(e)(6)(i) against any market participants currently clearing indirect participant activity that are not ready to comply with such policies and procedures, but it does not affect the ability of a covered clearing agency to implement such policies and procedures for those that are prepared to comply. If a direct participant of a U.S. Treasury covered clearing agency determines to offer certain access models or segregated margin accounts, the covered clearing agency would be obligated to enforce those rules regarding such models or accounts against the relevant participant, and the direct participant must comply with those rules.","Financial Regulations, Investment","Investors, US Economy",USA,,False,2025-04-03T16:12:55.125483
67eeb3885caf767e40cce696,SEC Announces Cyber and Emerging Technologies Unit to Protect Retail Investors,https://www.sec.gov/newsroom/press-releases/2025-42,,SEC,Securities and Exchange Commission,2025-42,"Laura D’Allaird appointed chief of the new unit

The Securities and Exchange Commission today announced the creation of the Cyber and Emerging Technologies Unit (CETU) to focus on combatting cyber-related misconduct and to protect retail investors from bad actors in the emerging technologies space. The CETU, led by Laura D’Allaird, replaces the Crypto Assets and Cyber Unit and is comprised of approximately 30 fraud specialists and attorneys across multiple SEC offices.

“Under Laura’s leadership","Laura D’Allaird appointed chief of the new unit

The Securities and Exchange Commission today announced the creation of the Cyber and Emerging Technologies Unit (CETU) to focus on combatting cyber-related misconduct and to protect retail investors from bad actors in the emerging technologies space. The CETU, led by Laura D’Allaird, replaces the Crypto Assets and Cyber Unit and is comprised of approximately 30 fraud specialists and attorneys across multiple SEC offices.

“Under Laura’s leadership, this new unit will complement the work of the Crypto Task Force led by Commissioner Hester Peirce. Importantly, the new unit will also allow the SEC to deploy enforcement resources judiciously,” said Acting Chairman Mark T. Uyeda. “The unit will not only protect investors but will also facilitate capital formation and market efficiency by clearing the way for innovation to grow. It will root out those seeking to misuse innovation to harm investors and diminish confidence in new technologies.”

Specifically, the CETU will utilize the staff’s substantial fintech and cyber-related experience to combat misconduct as it relates to securities transactions in the following priority areas:","Financial Regulations, Investment","Investors, US Economy",USA,,False,2025-04-03T16:12:56.054549
67eeb3885caf767e40cce697,SEC Announces 44th Annual Small Business Forum to Impact Capital-Raising Policy,https://www.sec.gov/newsroom/press-releases/2025-41,,SEC,Securities and Exchange Commission,2025-41,"The Securities and Exchange Commission will host the SEC’s 44th Annual Government-Business Forum on Small Business Capital Formation at SEC Headquarters in Washington, D.C. on April 10 from 1 – 4:30 p.m. ET.

The forum brings together members of the public and private sectors to discuss and provide suggestions to improve policy affecting how entrepreneurs, small businesses, and smaller public companies raise capital from investors.

“The annual Small Business Forum provides an important platform","The Securities and Exchange Commission will host the SEC’s 44th Annual Government-Business Forum on Small Business Capital Formation at SEC Headquarters in Washington, D.C. on April 10 from 1 – 4:30 p.m. ET.

The forum brings together members of the public and private sectors to discuss and provide suggestions to improve policy affecting how entrepreneurs, small businesses, and smaller public companies raise capital from investors.

“The annual Small Business Forum provides an important platform for identifying pressing issues affecting capital raising for small businesses in communities across the country,” said SEC Acting Chairman Mark Uyeda. “We encourage entrepreneurs, investors, and members of the public to join us for this important event.”

The event will feature appearances by SEC Commissioners and discussions with thought leaders from across the small business ecosystem on capital raising by early- to late-stage private companies and smaller public companies. All forum participants whether in person or viewing online will have the opportunity to submit policy recommendations in advance and to vote online at the end of the event to prioritize those recommendations that will be included in a report for the Commission and Congress.

The forum, which was hosted virtually from 2020-2024, will return to an in-person format while also continuing to allow for virtual attendance so individuals unable to attend in person can participate.

Registration information and a full agenda will be announced and available on SEC.gov as the event draws closer.","Financial Regulations, Investment","Investors, US Economy",USA,,False,2025-04-03T16:12:56.901867
67eeb3895caf767e40cce698,SEC Seeks Candidates for Membership on the Investor Advisory Committee,https://www.sec.gov/newsroom/press-releases/2025-40,,SEC,Securities and Exchange Commission,2025-40,"The Securities and Exchange Commission is seeking candidates for appointment as members of the SEC’s Investor Advisory Committee, which was established by the Dodd-Frank Wall Street Reform and Consumer Protection Act to help protect investors and improve securities regulation. Candidates will be considered for open at-large membership positions on the committee, as well as for a position as the member who is representative of the interests of senior citizens, as provided in the Act.

The purpose","The Securities and Exchange Commission is seeking candidates for appointment as members of the SEC’s Investor Advisory Committee, which was established by the Dodd-Frank Wall Street Reform and Consumer Protection Act to help protect investors and improve securities regulation. Candidates will be considered for open at-large membership positions on the committee, as well as for a position as the member who is representative of the interests of senior citizens, as provided in the Act.

The purpose of the Investor Advisory Committee is to advise the Commission, protect investor interests and promote the integrity of the securities marketplace. Committee members represent the interests of investors, are knowledgeable about investment issues, and have reputations for integrity.

The committee advises and consults with the Commission on:

Regulatory priorities of the Commission;

Issues relating to the regulation of securities products, trading strategies, fee structures, and the effectiveness of disclosure;

Initiatives to protect investor interests; and

Initiatives to promote investor confidence and the integrity of the securities marketplace.

“We look forward to receiving candidates who want to serve on the Investor Advisory Committee,” said SEC Acting Chairman Mark T. Uyeda. “Obtaining a variety of investor views helps the SEC to fulfill our mission on behalf of American issuers and investors.”

Members of the public interested in serving on the committee in either of the above capacities should promptly email a letter of interest to iac-candidates@sec.gov with applicable information about their relevant experience. The letter of interest should indicate whether the person submitting the letter seeks to serve as one of the at-large committee members or as the committee member representing the interests of senior citizens. The deadline for submission of a letter of interest is March 15, 2025. Those who have previously applied for membership on the committee must re-apply to be considered at this time.","Financial Regulations, Investment","Investors, US Economy",USA,,False,2025-04-03T16:12:57.890659
67eeb38a5caf767e40cce699,SEC Charges One Oak Capital Management and Michael DeRosa with Breaching Fiduciary Duties to Clients,https://www.sec.gov/newsroom/press-releases/2025-39,,SEC,Securities and Exchange Commission,2025-39,"The Securities and Exchange Commission today filed settled charges against New York-based registered investment adviser One Oak Capital Management LLC, and former One Oak investment adviser representative, Michael DeRosa, for misconduct related to advisory services provided to their retail clients.

According to the SEC’s order, from approximately June 2020 through October 2023, One Oak and DeRosa recommended that DeRosa’s customers at an unaffiliated broker-dealer, at which he was simultaneousl","The Securities and Exchange Commission today filed settled charges against New York-based registered investment adviser One Oak Capital Management LLC, and former One Oak investment adviser representative, Michael DeRosa, for misconduct related to advisory services provided to their retail clients.

According to the SEC’s order, from approximately June 2020 through October 2023, One Oak and DeRosa recommended that DeRosa’s customers at an unaffiliated broker-dealer, at which he was simultaneously employed, convert more than 180 brokerage accounts to advisory accounts at One Oak. Most of these customers were elderly and had been long-time customers of DeRosa’s at the broker-dealer, which charged the customers on a commission basis. According to the order, One Oak and DeRosa ignored their fiduciary duty and failed to adequately disclose that the conversions from brokerage accounts to advisory accounts would result in significantly higher fees for the clients and increased compensation for DeRosa; nor did they disclose the resulting conflict of interest. The order finds that the change in fee structure resulted in significantly increased costs, but the clients generally received no additional services or benefits. The order further finds that One Oak and DeRosa failed to adequately consider whether it was in their clients’ best interests to convert their brokerage accounts to advisory accounts, and in fact, many of the accounts were not suitable to be advisory accounts.

“We remain committed to holding accountable investment advisers who breach their fiduciary duties at the expense of retail clients,” said Tejal D. Shah, Associate Regional Director in the New York Regional Office. “One Oak and DeRosa converted brokerage accounts to advisory accounts when it benefitted them through higher fees, but that conversion was not in their clients’ best interests.”

The SEC’s order finds that One Oak and DeRosa willfully violated the antifraud provisions of Section 206(2) of the Investment Advisers Act of 1940, and that One Oak also violated the compliance rule provisions of the Advisers Act. Without admitting or denying the SEC’s findings, One Oak consented to an order requiring it to pay a civil penalty of $150,000 and to retain an independent compliance consultant to review certain of its policies and procedures related to its retail business. Without admitting or denying the findings in the order, DeRosa agreed to a civil penalty of $75,000 and to a nine-month industry suspension.

The SEC’s investigation was conducted by Alexander M. Levine, Hermann A. Vargas, and Liora Sukhatme under the supervision of Ms. Shah, all of the New York Regional Office. The SEC appreciates the assistance of Thomas Strafaci, Stephanie A. Morena, David Jaffe, and Jennifer A. Grumbrecht of the Division of Examinations in the New York Regional Office.","Financial Regulations, Investment","Investors, US Economy",USA,,False,2025-04-03T16:12:58.834316
