_id,title,link,date,source,regulatory_body,release_no,content,full_content,categories,impact_areas,geographic_scope,summary,processed,last_updated
67eeb13eaef5d5cad1618941,Daily  Variable Rate Repo (VRR) Auction,https://www.rbi.org.in/Scripts/BS_PressReleaseDisplay.aspx?prid=60143,2025-04-03T16:03:10.492069,RBI,Reserve Bank of India,,"As announced vide the , the Reserve Bank will be conducting daily Variable Rate Repo (VRR) auctions on all working days in Mumbai with reversal taking place on the next working day, until further notice.

2. Based on assessment of the liquidity conditions, it is decided that the notified amount for the daily Variable Rate Repo (VRR) auction to be conducted on April 04, 2025, Friday, between 10:00 AM and 10:30 AM will be ₹25,000 crore.

3. Further, on a review of evolving liquidity conditions, it","As announced vide the , the Reserve Bank will be conducting daily Variable Rate Repo (VRR) auctions on all working days in Mumbai with reversal taking place on the next working day, until further notice.

2. Based on assessment of the liquidity conditions, it is decided that the notified amount for the daily Variable Rate Repo (VRR) auction to be conducted on April 04, 2025, Friday, between 10:00 AM and 10:30 AM will be ₹25,000 crore.

3. Further, on a review of evolving liquidity conditions, it has been decided not to conduct the 14-day main operation for the upcoming fortnight i.e., April 04-17, 2025.

(Puneet Pancholy)

Chief General Manager

Press Release: 2025-2026/28","Monetary Policy, Banking Regulations","Banking Sector, Indian Economy",India,,False,2025-04-03T16:03:10.492108
67eeb143aef5d5cad1618942,"Dr. Poonam Gupta appointed as Deputy Governor, Reserve Bank of India",https://rbi.org.in/Scripts/BS_PressReleaseDisplay.aspx?prid=60141,2025-04-03T16:03:15.255636,RBI,Reserve Bank of India,,"Government of India in exercise of the powers conferred by clause (a) of sub-section (1) read with sub-section (4) of section 8 of The Reserve Bank of India Act, 1934, has appointed Dr. Poonam Gupta, Director General, National Council of Applied Economic Research, New Delhi as Deputy Governor of Reserve Bank of India for a period of three years from the date of joining the post or until further orders, whichever is earlier. (Puneet Pancholy)

Chief General Manager Press Release: 2025-2026/26","Government of India in exercise of the powers conferred by clause (a) of sub-section (1) read with sub-section (4) of section 8 of The Reserve Bank of India Act, 1934, has appointed Dr. Poonam Gupta, Director General, National Council of Applied Economic Research, New Delhi as Deputy Governor of Reserve Bank of India for a period of three years from the date of joining the post or until further orders, whichever is earlier. (Puneet Pancholy)

Chief General Manager Press Release: 2025-2026/26","Monetary Policy, Banking Regulations","Banking Sector, Indian Economy",India,,False,2025-04-03T16:03:15.255643
67eeb146aef5d5cad1618943,RBI Commemorates Completion of its 90th year,https://www.rbi.org.in/Scripts/BS_PressReleaseDisplay.aspx?prid=60123,2025-04-03T16:03:18.218104,RBI,Reserve Bank of India,,"The Reserve Bank of India (RBI) celebrated its 90th anniversary today. To recognize this important milestone, an event was organised by the Reserve Bank of India today with the Hon’ble President of India Smt. Droupadi Murmu as the Chief Guest. Hon’ble Governor of Maharashtra, Shri C.P. Radhakrishnan, Hon’ble Chief Minister of Maharashtra, Shri Devendra Fadnavis, Hon’ble Union Minister of Communications, Shri Jyotiraditya Scindia, Hon’ble Deputy Chief Ministers of Maharashtra, Shri Eknath Shinde ","The Reserve Bank of India (RBI) celebrated its 90th anniversary today. To recognize this important milestone, an event was organised by the Reserve Bank of India today with the Hon’ble President of India Smt. Droupadi Murmu as the Chief Guest. Hon’ble Governor of Maharashtra, Shri C.P. Radhakrishnan, Hon’ble Chief Minister of Maharashtra, Shri Devendra Fadnavis, Hon’ble Union Minister of Communications, Shri Jyotiraditya Scindia, Hon’ble Deputy Chief Ministers of Maharashtra, Shri Eknath Shinde and Shri Ajit Pawar also graced the event. In his welcome address, Governor, RBI expressed gratitude to the Hon’ble President of India for her participation in the event. He emphasized the Reserve Bank’s commitment to improving the financial system and contributing proactively and vigorously to India's economic progress. The Union Minister of Communications in his address acknowledged RBI’s contributions over the decades in ensuring financial sector resilience and supporting economic growth. He highlighted that RBI’s collaborative approach in striking a balance between regulation and innovation was a beacon of hope not just for the Global South but also developed economies especially in areas such as digital payments. The Hon’ble President, in her address, emphasized the important role of RBI in India’s journey and its economic and financial transformation. She highlighted that RBI has earned the trust of people by its commitment to maintaining price stability, growth and financial stability over the last nine decades. While underlining several important initiatives of the Reserve Bank in the areas of institution building, financial inclusion, consumer protection, digital payments, financial awareness and sustainable finance, the Hon’ble President also expressed confidence that RBI will continue to play a critical role in steering India towards a future of prosperity and global leadership. To mark this momentous occasion, a commemorative postage stamp was released by the Hon’ble President. The event was attended by distinguished dignitaries from the Government, financial sector regulatory institutions, industry, academia, the directors of the Central board of the Reserve Bank, heads of banks and other financial institutions and senior executives, both past and present, of the Reserve Bank. (Puneet Pancholy)

Chief General Manager Press Release: 2025-2026/8","Monetary Policy, Banking Regulations","Banking Sector, Indian Economy",India,,False,2025-04-03T16:03:18.218116
