_id,title,link,date,source,regulatory_body,release_no,content,full_content,categories,impact_areas,geographic_scope,summary,processed,last_updated
newsapi_0,"US sanctions 8 crypto wallets tied to Garantex, Houthis",https://cointelegraph.com/news/us-sanctions-crypto-wallets-garantex-houthis,2025-04-03T11:46:03Z,NewsAPI,,,"The US Treasury Department sanctioned eight cryptocurrency wallet addresses linked to Russian crypto exchange Garantex and the Yemeni political and military organization the Houthis.

The United States Office of Foreign Assets Control (OFAC) sanctioned eight crypto addresses that data from blockchain forensic firms Chainalysis and TRM Labs had linked to the organizations. Two are deposit addresses at major crypto platforms, while the other six are privately controlled.

Visualization of transact","The US Treasury Department sanctioned eight cryptocurrency wallet addresses linked to Russian crypto exchange Garantex and the Yemeni political and military organization the Houthis.

The United States Office of Foreign Assets Control (OFAC) sanctioned eight crypto addresses that data from blockchain forensic firms Chainalysis and TRM Labs had linked to the organizations. Two are deposit addresses at major crypto platforms, while the other six are privately controlled.

Visualization of transaction flow related to OFAC sanctions. Source: Chainalysis

The addresses in question reportedly moved nearly $1 billion worth of funds linked to sanctioned entities. Most of the transactions funded Houthi operations in Yemen and the Red Sea region.

Slava Demchuk, a crypto-focused money laundering specialist and United Nations Office on Drugs and Crime consultant told Cointelegraph that “the inclusion of Houthi-linked wallets reflects a broader recognition of crypto’s role in geopolitical conflicts and terrorism financing.” He added:

“The implications are far-reaching — compliance frameworks must adapt swiftly, attribution efforts will intensify, and decentralized platforms may face increased scrutiny.“

Demchuk highlighted that the situation reshapes the regulatory landscape. According to him, crypto “is now firmly within the scope of international security.

Who are the Houthis?

The Houthis, also known as Ansar Allah, are a Yemeni political and armed movement that emerged from the Zaidi Shia community. Originating as a revivalist and reformist group, they later became a major force in Yemen’s ongoing conflict.

Related: US DOJ says it seized Hamas crypto meant to finance terrorism

In recent years, the Houthis have engaged in attacks against both military and civilian vessels in the Red Sea with missiles and drones. In January, US President Donald Trump designated the group as a foreign terrorist organization.

The announcement noted that “the Houthis’ activities threaten the security of American civilians and personnel in the Middle East, the safety of our closest regional partners, and the stability of global maritime trade.” The group was recently struck by a US bombing campaign.

Related: Binance claims’ no special relationship’ with Hamas, argues to dismiss lawsuit

Garantex: Russia’s crypto laundromat

Garantex is a Russian crypto exchange that was sanctioned and shut down in early March after purportedly helping money-laundering efforts. At the time, Tether — the leading stablecoin operator and issuer of USDt — froze $27 million in USDt on the platform, forcing it to halt operations.

The platform has reportedly shifted millions of dollars as it sought to reboot under its new brand, “Grinex.”

In mid-March, officials with India’s Central Bureau of Investigation announced the arrest of Lithuanian national Aleksej Bešciokov, who was alleged to have operated the cryptocurrency exchange Garantex.

The arrest of the alleged Garantex founder was based on US charges of conspiracy to commit money laundering, conspiracy to operate an unlicensed money-transmitting business and conspiracy to violate the International Emergency Economic Powers Act.

Magazine: Financial nihilism in crypto is over — It’s time to dream big again",Regulatory News,Global Compliance,Global,,False,2025-04-04T11:52:10.342467
newsapi_1,Enhancing Global Capability Centers Through The BOTT Model,https://www.forbes.com/councils/forbesbusinessdevelopmentcouncil/2025/04/03/enhancing-global-capability-centers-through-the-bott-model/,2025-04-03T11:45:00Z,NewsAPI,,,"ByVishal Dugar  ByVishal Dugar,  Forbes Councils Member.  Vishal Dugar, Growth Leader at Cognizant Technology Solutions, has 20+ years of global experience in banking & financial services.   Today, companies are constantly seeking innovative ways to enhance their digital presence and streamline operations. One strategy that has gained considerable momentum is the Build-Operate-Transform-Transfer (BOTT) model. This model provides a structured and systematic approach to establishing and managing a","ByVishal Dugar  ByVishal Dugar,  Forbes Councils Member.  Vishal Dugar, Growth Leader at Cognizant Technology Solutions, has 20+ years of global experience in banking & financial services.   Today, companies are constantly seeking innovative ways to enhance their digital presence and streamline operations. One strategy that has gained considerable momentum is the Build-Operate-Transform-Transfer (BOTT) model. This model provides a structured and systematic approach to establishing and managing a successful Global Capability Center (GCC). With over two decades of experience assisting clients in achieving industry leadership, I have found that establishing and running GCCs through the BOTT model is key to maximizing both effectiveness and efficiency. A Global Capability Center is an established entity within an organization designed to harness global talent and resources to deliver high-value services and capabilities. These centers are typically located in regions with a rich talent pool and cost advantages, enabling organizations to optimize operational efficiency, drive innovation and enhance service delivery across various functions such as IT, finance, human resources and research and development. By centralizing expertise and capabilities, GCCs play a crucial role in supporting an organization's global operations and strategic objectives. The BOTT model, a strategic framework for establishing GCCs, encompasses four phases: build, operate, transform and transfer. It is also popularly known as BOT (build, operate and transfer). In many cases today, service providers work closely with industry players to assist with GCCs. As per the Everest Group, a couple of years ago, the number of GCCs set up using the BOT model accounted for less than 10% and is now nearly 40%. When combined with an assisted approach, that figure increases to over 90% of GCC setups today. Each phase of the BOTT model involves specific steps and guidelines to ensure a smooth transition and successful execution: In the Build phase, several key activities must be meticulously executed to establish a robust foundation for the GCC: • Strategic Planning And Design: Craft a comprehensive blueprint that aligns with the organization's strategic objectives, detailing the GCC's structure, functions and operational workflows. I have seen that working with experienced service providers helps in this stage immensely. • Site Selection And Infrastructure Development: Identify an optimal location based on talent availability, cost efficiency and regulatory environment, and then develop the necessary physical and technological infrastructure. • Talent Acquisition And Onboarding: Recruit a skilled workforce that meets the GCC's specific requirements, including sourcing talent, conducting interviews and onboarding new hires. Over the years, I have seen that relying only on just-in-time hiring may not help. Companies should work with service providers who can utilize their bench, too, for talent deployment. • Technology Implementation: Deploy state-of-the-art technology solutions to enable seamless operations, including IT systems, software applications and communication networks. • Regulatory Compliance And Risk Management: Ensure adherence to local laws and regulations and implement risk management strategies to mitigate potential challenges. • Stakeholder Engagement And Communication: Establish clear communication channels with key stakeholders to ensure alignment and support throughout the build phase. In the Operate phase, the focus shifts to ensure the GCC functions optimally: • Operational Management: Oversee day-to-day operations, including HR, finance, legal, procurement, workflows and resource allocation, and adhere to service-level agreements (SLAs). • Facilities Management: Manage building operations, maintain cleanliness and hygiene standards, conduct regular maintenance and repairs and implement robust security measures. • Performance Monitoring And Reporting: Track KPIs to measure effectiveness and identify ways to improve operations. Based on my experience, a joint program governance team is key here. • Quality Assurance: Implement rigorous quality control measures, including regular audits, process reviews and corrective actions. • Talent Management: Foster a skilled and motivated workforce through ongoing training, development programs and performance evaluations. • Technology Maintenance And Upgrades: Ensure the technology infrastructure remains robust and up to date through regular maintenance and the integration of new technologies. • Security Management: Implement comprehensive security protocols to protect against cyber threats, unauthorized access and data breaches. • Stakeholder Communication: Maintain open and transparent communication with key stakeholders, including clients, senior management and team members. The Transform phase focuses on elevating the GCC to a higher level of performance and innovation: • Integration Of Advanced Technologies: Implement cutting-edge technologies such as AI, machine learning and robotic process automation. • Process Reengineering: Redesign and optimize existing processes to improve productivity and reduce costs. • Workforce Upskilling: Provide comprehensive training and development programs to equip the workforce with new skills and competencies. • Change Management: Implement structured change management initiatives to ensure smooth adoption of new technologies and processes. • Performance Optimization: Continuously monitor and analyze performance metrics to identify areas for improvement. • Innovation And Continuous Improvement: Foster a culture of innovation and continuous improvement by encouraging creative problem-solving and adopting new ideas. In the Transfer phase, the focus should be on ensuring a seamless handover of the GCC to the organization: • Transition Planning: Develop a comprehensive transition plan that outlines the steps and timelines for the handover process. • Knowledge Transfer: Conduct extensive knowledge transfer sessions to equip the organization's team with the necessary skills and expertise. • Asset And Responsibility Transfer: Facilitate the transfer of all physical and intellectual assets, including technology infrastructure and operational processes. • Operational Handover: Ensure smooth operational handover by transitioning day-to-day management responsibilities to the organization's team. • Post-Transfer Support: Offer ongoing support and assistance post-transfer to ensure the GCC continues operating efficiently. • Performance Monitoring And Evaluation: Establish mechanisms for continuous performance monitoring and evaluation to beat the organization's expectations. The BOTT model offers a comprehensive and structured approach to establishing and managing GCCs. By meticulously executing each phase, organizations can optimize operational efficiency, drive innovation and enhance service delivery. Based on my decades of experience, I have seen that leveraging the expertise of service firms experienced in the BOTT model can further mitigate risks and ensure a smooth, value-driven establishment of GCCs. Ultimately, the successful implementation of the BOTT model enables organizations to fully leverage the capabilities of their GCCs, supporting their global operations and strategic objectives. Forbes Business Development Council is an invitation-only community for sales and biz dev executives. Do I qualify?",Regulatory News,Global Compliance,Global,,False,2025-04-04T11:52:13.173983
