_id,title,link,date,source,regulatory_body,release_no,content,full_content,categories,impact_areas,geographic_scope,summary,processed,last_updated
newsapi_13,The UK’s Charity Commission has opened a case into the Sentebale mess,https://www.celebitchy.com/916488/the_uks_charity_commission_has_opened_a_case_into_the_sentebale_mess/,2025-04-03T11:27:09Z,NewsAPI,,,"Part of the reason why this Sentebale catastrophe has been churning away in the British tabloids is because few people believed that there could be some kind of mechanism in which Sophie Chandauka is thrown out of Sentebale. It’s an odd situation legally, because a majority of the board of trustees resigned in protest, as did Prince Harry and Prince Seeiso. Harry and Seeiso’s side has let it be known that they “expected” Chandauka’s “publicity stunt” interviews and her wild, nonsensical allegati","Part of the reason why this Sentebale catastrophe has been churning away in the British tabloids is because few people believed that there could be some kind of mechanism in which Sophie Chandauka is thrown out of Sentebale. It’s an odd situation legally, because a majority of the board of trustees resigned in protest, as did Prince Harry and Prince Seeiso. Harry and Seeiso’s side has let it be known that they “expected” Chandauka’s “publicity stunt” interviews and her wild, nonsensical allegations. But would anything happen beyond what amounts to a PR war? Well, the UK’s Charity Commission is now investigating the situation, and Prince Harry and Sophie Chandauka released new statements:

The Charity Commission is to investigate the bitter dispute that led to the Duke of Sussex and several others resigning from the charity he co-founded. The watchdog said it had opened a case to examine “concerns raised” about Sentebale, following claims made by its head Sophie Chandauka.

Ms Chandauka told the BBC she welcomed the move by the commission, which comes after she said she had “blown the whistle” on issues including bullying and harassment, and warned of the prince’s “toxicity” for the charity.

Prince Harry said: “What has transpired over the last week has been heartbreaking to witness, especially when such blatant lies hurt those who have invested decades in this shared goal.”

The duke, speaking on behalf of the former trustees and patrons, welcomed the watchdog’s announcement, saying it would be a “robust inquiry” which “we fully expect will unveil the truth that collectively forced us to resign”.

“We remain hopeful this will allow for the charity to be put in the right hands immediately, for the sake of the communities we serve,” said the prince.

The Charity Commission’s “regulatory compliance case” is the first step in assessing the complaints and allegations over what has happened at Sentebale, which was founded in 2006 to help children in southern Africa affected by HIV and Aids.

A statement from the watchdog said it was “in direct contact with parties who have raised concerns” and would gather evidence to see whether those running the charity, past and present, had complied with their “duties and responsibilities under charity law”.

“From the inception of Sentebale nearly 20 years ago, Prince Seeiso and I have had a clear goal – to support the children and young people in southern Africa in memory of our mothers,” said Prince Harry, responding to the charity watchdog’s announcement.

On Thursday, Ms Chandauka said in a statement that the concerns brought to the commission included “governance, administration and management matters”. The Sentebale head said she hoped the public and donors would now see there was a new board of trustees “acting appropriately to demonstrate and ensure good governance and a healthy culture”.",Regulatory News,Global Compliance,Global,,False,2025-04-04T11:52:37.136694
newsapi_14,Trump creates U.S. Investment Accelerator to manage CHIPS Act and 'negotiate much better deals',https://www.tomshardware.com/tech-industry/trump-creates-u-s-investment-accelerator-to-manage-chips-act-and-negotiate-much-better-deals,2025-04-03T11:25:51Z,NewsAPI,,,"U.S. President Donald Trump signed an executive order Tuesday that will create the United States Investment Accelerator Office within the Department of Commerce. According to the White House, it “shall focus on delivering the benefit of the bargain for taxpayers by negotiating much better deals than those of the previous administration.”

The order did not detail how this would affect already existing contracts and awards.

There were hints that Trump did not like President Biden’s CHIPS and Sci","U.S. President Donald Trump signed an executive order Tuesday that will create the United States Investment Accelerator Office within the Department of Commerce. According to the White House, it “shall focus on delivering the benefit of the bargain for taxpayers by negotiating much better deals than those of the previous administration.”

The order did not detail how this would affect already existing contracts and awards.

There were hints that Trump did not like President Biden’s CHIPS and Science Act strategy to get semiconductor investments into the U.S. during his campaign. This became crystal clear in his first address to Congress in March, when he told the House Speaker to “get rid of the CHIPS Act” and spend the money for it to “reduce debt or any other reason you want to.”

Aside from this, the federal government staff purge hit the CHIPS Act office just a few days before the speech, with at least two-fifths of the current staff reportedly terminated.

The White House started reviewing CHIPS Act awards in February; some people familiar with the matter said the new administration wanted to renegotiate the terms enforced under the deal to “align with President Trump’s executive orders and policies.” It’s still unclear how these reviews will affect CHIPS Act winners, but scheduled fund disbursements are expected to be delayed.

Still, it’s not all bad news for the semiconductor industry. The setting up of the U.S. Investment Accelerator office implies that the White House is seemingly continuing with the CHIPS Act and that companies that expect to receive subsidies aren’t going to be completely stiffed by the new administration.

Furthermore, the executive order also directs it to assist investors for efficiency, reduce regulations, increase access to and use of national resources, facilitate research, and reduce regulatory barriers to increase investment in the United States. This new office is designed not just to release new federal funding for semiconductor investments but also to use the existing frameworks in Federal law so that anyone investing in the U.S. can take advantage of them.

Stay On the Cutting Edge: Get the Tom's Hardware Newsletter Get Tom's Hardware's best news and in-depth reviews, straight to your inbox. Contact me with news and offers from other Future brands Receive email from us on behalf of our trusted partners or sponsors

Despite Trump’s criticism of the CHIPS Act, he still understands the importance of the semiconductor industry. He even had TSMC announce an additional $100 billion investment in its Arizona plant in the White House, while Congress introduced an act that would give tax credits to chip designers. The current administration says that the most advanced AI chips will be built in the U.S., and the U.S. Investment Accelerator office will likely pave the way to help massive tech companies achieve that within its borders.",Regulatory News,Global Compliance,Global,,False,2025-04-04T11:52:39.883569
newsapi_15,Automatic Car Wash Market Report 2025-2030 | How a $4.66B Market is Being Shaped by Digital Transformation,https://www.globenewswire.com/news-release/2025/04/03/3055013/28124/en/Automatic-Car-Wash-Market-Report-2025-2030-How-a-4-66B-Market-is-Being-Shaped-by-Digital-Transformation.html,2025-04-03T11:25:00Z,NewsAPI,,,"Dublin, April 03, 2025 (GLOBE NEWSWIRE) -- The ""Automatic Car Wash Market by Component (Equipment, Services), System (Conveyor Car Wash, In-Bay Car Wash), Type, End User - Global Forecast 2025-2030"" report has been added to ResearchAndMarkets.com's offering.



The Automatic Car Wash Market grew from USD 2.57 billion in 2024 to USD 2.82 billion in 2025. It is expected to continue growing at a CAGR of 10.45%, reaching USD 4.66 billion by 2030.



The automatic car wash market has experienced tran","Dublin, April 03, 2025 (GLOBE NEWSWIRE) -- The ""Automatic Car Wash Market by Component (Equipment, Services), System (Conveyor Car Wash, In-Bay Car Wash), Type, End User - Global Forecast 2025-2030"" report has been added to ResearchAndMarkets.com's offering.



The Automatic Car Wash Market grew from USD 2.57 billion in 2024 to USD 2.82 billion in 2025. It is expected to continue growing at a CAGR of 10.45%, reaching USD 4.66 billion by 2030.



The automatic car wash market has experienced transformative shifts that have redefined its operational landscape. Rapid technological advancements have ushered in a new era where traditional car wash methods are giving way to systems that champion efficiency, sustainability, and superior customer experience. Innovations in sensor technologies, robotics, and precision engineering are at the forefront of this evolution, enabling faster throughput, higher quality results, and a significant reduction in resource consumption.



Stakeholders have observed a marked transition from manual labor-intensive operations to systems guided by intelligent automation. This evolution is largely due to the integration of advanced control systems that allow for real-time monitoring and customization of the cleaning process. The introduction of programmable solutions that can adapt to varying vehicle sizes and soil levels means that the process is no longer a one-size-fits-all approach. Instead, it is tailored to meet specific cleaning requirements which enhances not only customer satisfaction but also the operational efficiency of service centers.



Concurrently, environmental considerations have become a pivotal driver in the industry. Stricter regulatory standards combined with growing public awareness have compelled companies to incorporate water recycling systems and eco-friendly detergents. These sustainable practices have not only minimized the environmental footprint but have also resulted in long-term cost savings, a benefit that appeals to both service providers and end consumers.



The market's evolution is also marked by an increased emphasis on digitization. Many car wash operations now incorporate advanced software for appointment scheduling, process tracking, and customer feedback collection, leading to improved responsiveness and customer engagement. Such digital integrations are catalyzing a transformation that positions the market at the cusp of a new, more efficient business model. As companies continue to adapt to these shifts, there is an unmistakable movement towards a future where automated technologies define every facet of the service delivery process.



Key Regional Insights Shaping Market Dynamics



Regional dynamics in the automatic car wash market offer critical insights into how geographic and economic factors shape industry trends. In the Americas, technological adoption is particularly rapid, driven by both consumer demand and robust regulatory environments that emphasize sustainability and operational efficiency. Business models in this region have evolved to integrate innovative cleaning technologies with a focus on meeting diverse consumer needs in both urban and suburban settings.



When turning to the region that spans Europe, the Middle East, and Africa, distinctive market characteristics emerge that are influenced by a blend of mature technological infrastructure and emerging opportunities. In Europe, the focus on environmental sustainability and energy-efficient systems has led to an accelerated adoption of advanced car wash equipment that conserves resources and adheres to stringent environmental standards. Similarly, in the Middle East and Africa, market dynamics are largely shaped by the burgeoning need for automated solutions that can handle a vast difference in vehicle types and environmental challenges, while also catering to growing economies that are rapidly industrializing.



The Asia-Pacific region presents a particularly vibrant and diverse market scenario. Rapid urbanization and rising disposable incomes have spurred an increasing demand for automated car wash services. In this region, the prevalence of modern infrastructure combined with a tech-savvy consumer base is driving major investments in state-of-the-art cleaning systems. The Asia-Pacific market distinguishes itself by balancing cost efficiency with high standards of quality through the adoption of best-in-class cleaning technologies and robust service models. Overall, the regional insights underscore the importance of tailored strategies that address specific economic conditions, consumer behaviors, and regulatory frameworks, thus critically shaping market outlooks and growth trajectories worldwide.



Market Leaders and Innovations: Company Insights



Examining the competitive landscape in the automatic car wash market reveals a complex ecosystem populated by several key companies, each contributing uniquely to technological advancements and service innovation. Prominent players such as Autec Car Wash Systems and Banner Engineering Corporation have carved out significant positions by investing heavily in research and development and by continuously refining product portfolios. Carolina Pride Car Wash Systems & Solutions Inc. and Coleman Hanna Car Wash Systems are notable for their pioneering approaches to equipment design, ensuring that their offerings meet the evolving needs of both service providers and end users.



Similarly, companies like D&S Car Wash Equipment Company and Daifuku Co., Ltd. have emerged as influential players, capitalizing on the demand for integrated systems that combine reliability with cutting-edge cleaning technology. Degama S.r.l. and Inventa Cleantec Private Limited have further demonstrated excellence by delivering solutions that embrace automation and digitalization, thereby raising industry standards. The role of Istobal S.A. and KKE Wash Systems Private Limited is distinguished by their focus on scalability, ensuring that service centers of all sizes can benefit from advanced car wash systems.



Other noteworthy companies include Liaoning CBK Carwash Solutions Co., Ltd. and Manmachine Works Pvt. Ltd., which are renowned for their innovative design philosophies and engineering prowess. MK Seiko Co., Ltd. and Motor City Wash Works, Inc. continue to set benchmarks within the market with a keen emphasis on durability and performance under varying operational conditions. The contributions of Otto Christ AG, PECO Car Wash Systems, and Prestige Car Wash Equipment in terms of fostering sustainable practices have been particularly influential.

Moreover, industry leaders such as Ryko Solutions, Inc., SMS Industrial Equipment, Tammermatic, and Tommy Car Wash Systems have further expanded the boundaries of what is possible by seamlessly integrating technological advancements with real-world applications. The consistent innovations from Treo Engineering Private Limited, Varadom Technologies Private Limited, WashTec AG, and Washworld, Inc. emphasize the collaborative spirit that propels the market forward, ensuring that continuous improvement and customer satisfaction remain at the heart of the industry's growth trajectory.



The report delves into recent significant developments in the Automatic Car Wash Market, highlighting leading vendors and their innovative profiles. These include:

Autec Car Wash Systems

Banner Engineering Corporation

Carolina Pride Car Wash Systems & Solutions Inc.

Coleman Hanna Car Wash Systems

D&S Car Wash Equipment Company

Daifuku Co., Ltd.

Degama S.r.l.

Inventa Cleantec Private Limited

Istobal S.A.

KKE Wash Systems Private Limited

Liaoning CBK Carwash Solutions Co., Ltd.

Manmachine Works Pvt. Ltd.

MK Seiko Co., Ltd.

Motor City Wash Works, Inc.

Otto Christ AG

PECO Car Wash Systems

Prestige Car Wash Equipment

Ryko Solutions, Inc.

SMS Industrial Equipment

Tammermatic

Tommy Car Wash Systems

Treo Engineering Private Limited

Varadom Technologies Private Limited

WashTec AG

Washworld, Inc.

Actionable Recommendations for Market Growth and Innovation



For industry leaders aiming to capitalize on the upward trend of the automatic car wash market, several actionable recommendations come to the forefront. A strategic investment in advanced automation technologies is critical, as leveraging intelligent systems enhances operational efficiency and customer satisfaction. Leaders must prioritize the integration of cutting-edge sensors and AI-driven monitoring systems that offer real-time diagnostics and custom cleaning routines tailored to the specific needs of diverse vehicle types.



Investments in sustainable technology represent another pivotal area of focus. With environmental regulations tightening globally, companies are advised to invest in water recycling systems and eco-friendly cleaning agents that not only address regulatory compliance but also reduce operational costs in the long run. Such investments not only ensure a smaller environmental footprint but also bolster the company's reputation as a forward-thinking and responsible service provider.



Diversifying service portfolios is essential for catering to segmented market needs. Offering flexible packages that include an array of cleaning options, from dry to wet car wash solutions, will allow providers to meet the distinct preferences of both commercial clients and individual customers. This flexible approach facilitates a better match between technology and customer expectations, thereby leading to enhanced service delivery and customer loyalty.



Emphasizing digital transformation must be a priority. Industry players need to adopt integrated digital platforms that facilitate efficient appointment scheduling, customer feedback, and process optimization. These digital systems not only streamline operations but also offer valuable data insights that can drive continuous improvement in service quality. Engaging in proactive collaboration with technology partners and continuously monitoring customer behavior trends can help companies stay ahead of the competition.



Finally, maintaining robust customer engagement through strategies such as loyalty programs and personalized promotions can significantly boost retention rates and market penetration. Industry leaders should leverage their comprehensive understanding of regional market differences to introduce tailored marketing campaigns and localized service offerings that resonate with unique consumer segments. By aligning technological investments with consumer demands and sustainable practices, industry leaders can propel their organizations towards robust growth and innovative service delivery in the competitive landscape of automatic car wash systems.



Key Attributes

Report Attribute Details No. of Pages 193 Forecast Period 2025-2030 Estimated Market Value (USD) in 2025 $2.82 Billion Forecasted Market Value (USD) by 2030 $4.66 Billion Compound Annual Growth Rate 10.4% Regions Covered Global

Key Topics Covered



1. Preface



2. Research Methodology



3. Executive Summary



4. Market Overview



5. Market Insights

5.1. Market Dynamics

5.1.1. Drivers

5.1.1.1. Increasing urbanization and busy consumer lifestyles drive demand for quick, convenient car wash services

5.1.1.2. Rising consumer awareness regarding vehicle care and aesthetics boosts interest in automatic car washes

5.1.2. Restraints

5.1.2.1. High initial setup cost and maintenance expenses associated with automatic car wash

5.1.3. Opportunities

5.1.3.1. Increasing popularity of eco-friendly car wash solutions drives opportunities for green technology

5.1.3.2. Technological advancements are enhancing the efficiency and appeal of automatic car wash solutions

5.1.4. Challenges

5.1.4.1. Technical and operational limitations of automatic car wash

5.2. Market Segmentation Analysis

5.2.1. Component: Equipment demand fueled by its influence on operational efficiency and service quality

5.2.2. End User: The prominence of automatic car washes particularly evident within commercial clients

5.3. Porter's Five Forces Analysis

5.3.1. Threat of New Entrants

5.3.2. Threat of Substitutes

5.3.3. Bargaining Power of Customers

5.3.4. Bargaining Power of Suppliers

5.3.5. Industry Rivalry

5.4. PESTLE Analysis

5.4.1. Political

5.4.2. Economic

5.4.3. Social

5.4.4. Technological

5.4.5. Legal

5.4.6. Environmental



6. Automatic Car Wash Market, by Component

6.1. Introduction

6.2. Equipment

6.2.1. Drives

6.2.2. Motors

6.2.3. Pumps

6.3. Services



7. Automatic Car Wash Market, by System

7.1. Introduction

7.2. Conveyor Car Wash

7.3. In-Bay Car Wash



8. Automatic Car Wash Market, by Type

8.1. Introduction

8.2. Dry Car Wash

8.3. Wet Car Wash



9. Automatic Car Wash Market, by End User

9.1. Introduction

9.2. Commercial Clients

9.2.1. Rental Services

9.2.2. Taxi Companies

9.3. Individual Customers



10. Americas Automatic Car Wash Market

10.1. Introduction

10.2. Argentina

10.3. Brazil

10.4. Canada

10.5. Mexico

10.6. United States



11. Asia-Pacific Automatic Car Wash Market

11.1. Introduction

11.2. Australia

11.3. China

11.4. India

11.5. Indonesia

11.6. Japan

11.7. Malaysia

11.8. Philippines

11.9. Singapore

11.10. South Korea

11.11. Taiwan

11.12. Thailand

11.13. Vietnam



12. Europe, Middle East & Africa Automatic Car Wash Market

12.1. Introduction

12.2. Denmark

12.3. Egypt

12.4. Finland

12.5. France

12.6. Germany

12.7. Israel

12.8. Italy

12.9. Netherlands

12.10. Nigeria

12.11. Norway

12.12. Poland

12.13. Qatar

12.14. Russia

12.15. Saudi Arabia

12.16. South Africa

12.17. Spain

12.18. Sweden

12.19. Switzerland

12.20. Turkey

12.21. United Arab Emirates

12.22. United Kingdom



13. Competitive Landscape

13.1. Market Share Analysis, 2024

13.2. FPNV Positioning Matrix, 2024

13.3. Competitive Scenario Analysis

13.3.1. OPW Vehicle Wash Solutions redefine car wash experiences with innovative add-ons and digital solutions

13.3.2. DiBO unveiling self-service carwash solutions with an app launch at UNITI 2024

13.3.3. Inchcape and Karcher launches automated water-saving car wash

13.3.4. UK's robotic touchless car wash opens in Carlisle

13.3.5. The Noida Authority (India) is planning to set up four automated car washing facilities using treated water on a public-private partnership mode

13.4. Strategy Analysis & Recommendations



For more information about this report visit https://www.researchandmarkets.com/r/bnkgcp

About ResearchAndMarkets.com

ResearchAndMarkets.com is the world's leading source for international market research reports and market data. We provide you with the latest data on international and regional markets, key industries, the top companies, new products and the latest trends.",Regulatory News,Global Compliance,Global,,False,2025-04-04T11:52:41.592018
